"                내 집 마련의 방법은 여러 가지가 있지만 경매를 통한 부동산 구입은 시세보다 저렴하게 살 수 있다는장점이 있어 매력적으로 다가온다.입지와 부동산 상태에 따라 다르겠지만 많게는 40%에서 10%까지 주변 부동산 가격보다 저렴한입찰가격은 '어 나도 해볼까?'라는 호승 심을 심어주기에 충분하다.부동산 경매 학원이 따로 있고 관련 특강이 많아서 늘 관심이 있었지만 경매라는 단어가 갖는부정적인 분위기를 무시할 수 없어 실행을 뒤로 미루고 있었다.부동산 경매라고 하니 집에 빨간 딱지가 붙을 거 같고, 죄 없는 거주자를 내쫓아야 할 것 같은 그림갑자기 집에서 쫓겨 나야 하는 사람들, 해결하지 못하는 문제들은경매를 시작하는 허들을 높게 만든다.나처럼 경매에 대해 두려워하는 사람들이 많을 것이다.이러한 사람들, 경매는 하고 싶지만 시작조차 겁나는 사람들을 위한 책을 이번에 읽게 되었다.경매 투자의 신이라 불리는 저자는 이미 경매 학원을 유명하고 24만 명의 독자가 있는유명한 유튜브 인플루언서이다.경매로 시작해 끝판왕이 된 경매 전문가가 쓴 이번 책은 단순한 경매 지식을 가르치는 것이 아니라경매에 대한 잘못된 선입견을 버리고 모두가 경매를 통해 부동산 투자로 부를 증식하는 마음으로 쓴 글이다.고등학교 졸업 후 바로 뛰어든 부동산 경매 시장에서 저자는 20년간 잃지 않는 경매 투자를 통해부자가 되는 법을 스스로 배우고 익혔다.부동산 경매를 전혀 모르는 사람도 이해할 수 있도록 부동산과 경매에 대한 개념을 설명하고,경매 입문자를 위한 가이드를 제시하고 있는 책은 경매를 시작하는 사람들이 처음 시작하기에가장 적절한 책일 듯싶다.총 5장으로 구성된 책은 1장에서 부자가 갖춰야 할 부의 마인드에 대해 설명한다. 긍정적인 마음으로 살아야 기회가 온다는 것, 이미 여러 책을 통해 확인한 부자 마음을 다시 한번 확인해 본다. 2장에서는 부동산 경매를 둘러싼 이해관계이다. 이 장에서는 우리가 잘 못 알고 있는 선입견을 깨기 위한 이야기로 구성되었다. 3장에서는 경매에 대한 기본 개념과 절 찾에 대해 공부할 수 있고 4장과 5장에서는 경매를 통해 수익을 만들 수 있는 노하우에 대해 확인할 수 있다.외제차를 구매하는 대신 경매를 통해 집을 구매하라고 조언하는 저자는 결국 경매를 통해 집을 구매한 사람이이후 얼마나 수익을 만들었는지 알려준다.스타벅스 커피를 마시지 말고, 스타벅스 주식을 사라라는 이야기와 일맥상통한다.어떤 땅이든 시간이 지나면 오른다는 것은 알고 있다. 그 땅이 문제가 없다면 말이다.3,000배 올랐다는 저자의 주장은 주요 도시의 황금 노른자 땅이어서 가능할 듯싶지만많은 땅들이 시간이 지나면 오른다는 것은 사실이다.부모님들도 새로 들어선 아파트 단지를 볼 때마다 저거 십 년 전에는 논 밭이었는데그때 살 걸 하며 아쉬워한다.부동산 지금이라도 사야 하나?경기도 어디 한 적한 땅이라도 구매해야 하는지, 참 곤란하다 곤란해.경매를 시작하기 어려운 건 경매 제도에 대한 제대로 된 이해가 없기 때문이다.이번에 경매가 왜 생겼는지 어떻게 진행되는지 알게 되니, 그동안 갖고 있던 경매에 대한 부정적인식견을 개선하게 되었다.기타 경매 용어는 경매 물건을 볼 때 좀 더 이해를 편하게 만들어줬고,부동산에 대한 지식을 업그레이드하게 했다. 슬슬 부린 이도 탈출해 볼까?책은 단순히 경매에 대한 저자의 지식 나눔이 아니라 실제 경매 경험을 보여주는 차이가 있다.저자가 낙찰받은 땅과 수익을 만든 방법, 토지에 대한 사진과 분석 노하우 리을 통해향후 경매를 할 때 도움을 받을 수 있을 것 같다.경매를 두려워하는 가장 큰 이유는 점유자에 대한 존재 때문일 것이다.내가 경매를 통해 받은 집에 이미 거주하고 있는 점유자에 대한 원만한 해결은 난이도가 매우 높은 문제명도를 어떻게 하면 좋을지, 그 과정에 필요한 방법은 무엇인지 확인해 보니나중에 같은 문제가 발생했을 때 도움이 될 것 같다.예전에 친한 분이 땅을 샀는데 속았다며 그 땅이 국립공원이어서 돈을 날렸다는 이야기를 들을 적이 있다.경매 물건에도 이렇게 토지이용 계획을 확인하면 하자가 있는 물건, 문제가 되는 물건을 확인할 수 있다고 한다.반드시, 물건에 대한 이용계획을 확인하고 입찰에 도전해야 한다.경매를 통해 자녀에게 부동산을 선물할 수 있다니! 원피스나 구두 대신 아낀 돈으로 집을 선물해 주는 부모라니엄청난 금수저 엄마가 될 수 있을 것 같다.나중에 시드머니가 마련되면 지방에 작은 빌라라도 경매를 통해 마련해서 월 20~30만 원 월세 수익을 통해용돈이 될 수 있도록 해봐야겠다.저자가 말하는 부자가 되는 투자 마인드 10가지는 책의 내용을 함축하고 있어마지막으로 10가지를 적어보며 정리한다.저축만 하면 불행한 노후를 맞이한다부동산은 1만 년 전부터 이어진 투자 자산이다.샀다 팔았다 하면 절대 돈 벌 수 없다.경매에서 10평짜리 땅이 9천 원에 나온다경매 용어 몰라도 돈 버는데 문제없다돈 없는 20대가 경매로 성공하기 더 쉽다초보자 눈에는 모든 물건이 좋아 보인다감정가와 현재 시세는 전혀 다르다아무도 쳐다보지 않는 물건이 대박 물건이다경매 수익이 2배가 되는 NPL에 투자하라부자가 되는 다양한 방법 중에 경매가 갖은 매력을 확인할 수 있었던 책밑줄 그어가며 열심히 읽었으니 다음에는 좀 더 어려운 경매 책에도 도전해 봐야겠다.- 출판사로부터 제공받아 솔직하게 작성한 글입니다 -                "
                경매의 경우 예전부터 조금 관심은 있었지만 어렵다는 생각이 들었는데 이번 기회에 조금 현명한 투자의 방법으로 경매를 더 이해하고싶어 이 책을 접하게 되었어요.이 책은 경매대마왕이라는 유튜브 채널을 운영하고 있는 비교적 젊은 분인데도 거의 20년동안 부동산경매에서 실전투자를 해왔기 때문에 책에 소개된 다양한 사례들만 읽어도 경매에 대한 매력에 푹 빠질수 있더라구요.무엇보다 저자가 강조한 것은 지식은 지식일뿐이지 경매에 대한 지식이 있으면 좋지만 반드시 모든 필요한 경매지식을 알고 경매를 아는 것은 아니며 주식이나 저축보다 경매야말로 매력적인 재산 증식의 방법이고 특히 젊은 세대에게는 더 경매로 성공하기 쉽다고 자신감을 불러일으켜 준답니다.저자가 강조하고 있는 부의 마인드는 즉 긍정의 마인드이기도 하더라구요. 경매를 하다보면 어떤 물건을 단순하게 서류로 봐서는 매력적이지않지만 내가 그 물건을 통해 돈을 벌어야겠다는 생각을 가지고 들여다보면 그 물건이 가지고 있는 메리트도 볼수 있고 실제 저자의 사례를 통해 남들에게는 별 볼일 없는 부동산이 대박 부동산으로 거듭나기도 하더군요.각 장의 말미에는 실전 투자 따라잡기란이 있는데 여기에는 저자가 실제 다루었던 물건에 대해 어떤 식으로 해당 물건을 잡고 수익을 냈는지를 보여주고 있어 더욱 경매가 주는 투자의 매력을 느낄수 있었답니다.요새 새로 각광받고 있는 NPL투자라는 것도 소개하고 있어서 넘 좋았어요. 다소 생소한 개념이었는데 NPL투자가 어떤 것이고 어떤 매력이 있는지를 알수있었답니다.누구나 부자가 되고싶어하고 누구는 또 이론적으로 충분한 지식을 가지고 있기도하지만 실제 부자가 되는 사람은 많지않죠. 저자의 적극적인 자세와 긍정마인드는 꼭 우리가 배워야할 부자가 되기위한 마인드임에 틀림없어 보입니다.                
"                저는 평소 '경매'는 너무 어렵고, '좋지 않은 부동산 투자'라는 선입견을 제 스스로 갖고 있었는데요,부동산 주인이 빚을 갚지 못해 어쩔수 없이 내놓은 부동산을 싸게 사서, 그 주인을 슬프게 하는 나쁜 행위, 나쁘게 돈을 버는 것이라 생각했죠 하지만, 심태승님의 이 책을 읽으면서 '경매'에 대한 부정적 편견을 버리게 되었습니다.경매는 나의 돈을 투자하여 채무자와 채권자의 불행한 관계를 끝내주는 행위다.경매가 진행되지 않는다면 물건을 처분해 돈을 받아야 할 채권자는 더 오랜 기간 고통을 받아야 한다.-책 56p. [경매를 하면 재수가 없다?] 中'경매'라는 것이 '무조건 나쁜것이 아니구나, 채무자와 채권자, 낙찰자 모두가 이로운 부동산 투자구나' 라는 생각을 하게 되었습니다.심태승 작가님은 20년 부동산경매 베테랑 투자자답게 '부의 마인드'를 심어주시더라고요'당신은 해낼 수 있다' ' 당신은 나보다 빠르게 성공할 것이다' '경매' 그걸 내가 할 수 있을까? 난 돈이 없는데? 아는게 없는데?망설이고 있을 독자들에게 용기를 불어넣어주면서 이야기를 시작하셨습니다.저는 최근 '경매'  자체를 경험한 적이 없어서, 이해할 수 있을까 이 책을 읽기 전 많이 염려되었는데요.세상에나 이렇게 재미있는 경매책은 처음이었습니다.본인이 20년동안 경험한 실제 사례를 들어가면서 용어를 설명해주니, 책이 막힘없이 읽혀졌습니다.'명도' '항고' 그게 뭐지? 했었는데, 자연스럽게 스토리텔링으로 경매를 풀어주시니 이해가 잘 되더라고요.'경매'라고 무조건 법대로 딱딱하게 집행 할 것이 아니라, 점유자,채무자,채권자,낙찰자 모두 각자의 입장을 이해한다면 보다 쉽게 풀릴 수 있다는 작가님의 지혜도 배웠습니다.작가님은 책 곳곳에 '경매' 란 사고의 전환이 필요한 것이다라고 말하고 있으신데요.이 말씀에 깊이 공감합니다. 작가님의 실전 사례를 읽으면서, 기존의 편견, 아집, 잘못된 지식으로 진짜 황금을 찾지 못하는 우를 범할 수 있다는 걸 알게 되었습니다.부동산 하락론자,상승론자의 말에 제 투자마인드가 흔들리곤 했는데,작가님은 기회는 언제든지 온다. 계속 준비하고 매사 새롭게 돌려볼수 있는 사고의 전환이 중요하다고 말하시네요이 책은 '경매'입문자 와'부동산' 투자 입문 부린이들께서 꼭 읽어보시기를 추천합니다.딱딱한 투자이론서가 아니기에, 더더욱 추천합니다. 경매학원 등록하여 수강하는 것도 좋지만,심태승 작가님의 이 책을 먼저 읽어보신후, 투자공부를 시작하기를 추천합니다.책 내용을 일일이 열거할수는 없지만, 투자기본서로 강력추천하는 바입니다.                "
"                책을 읽는 중간중간 나도 모르게 콧잔등이 시큰해지고 눈시울이 자꾸 붉어졌다. 아마 이나모리 가즈오 회장의 세라믹을 만드는 소성로보다도 더 뜨거운 열정에 감화되어서 그런 것도 있었을 것이고, 나도 이렇게 좋아하는 일에 미쳐보고 싶고 일에 푹 빠져서 살고 싶다고 생각하면서도 현실에 대한 불만을 품고 아무런 시도도 충분한 노력도 하지 않았던 나에 대한 부끄러움도 있었을 것이다. '일단 내가 좋아하는 일이 무엇인지 찾아다니기 전에, 지금 하고 있는 일에 미친듯이 몰두해보라' 는 구절을 읽고 고개를 끄덕이는 한편 무의식적으로 '내가 지금 하고 있는 회사 일은 몰두하거나 미쳐서 할 수 있는 일이 아닌데... 어떻게 하지?' 이런 생각이 먼저 들었다. 나의 열정은 여전히 잿더미 속에 묻힌 숯불처럼 아직 내 마음 어딘가에 잠들어있다는 반증이 아닐까 싶었다. '사람이 할 수 있는 최선의 노력을 다한 뒤 이제는 신께 빌며 천명을 기다리는 방법밖에 없다고 자신할 만큼 당신이 가진 모든 힘을 쏟아냈는가?' 나에게 던져진 이 질문이 너무 오랫동안 잊고 있었고 외면했던 말이라 스스로가 너무 부끄러웠다.어린 시절 시험공부하듯 반복해서 읽었던 이지성 작가의 '꿈꾸는 다락방' 이 너무나도 자연스럽게 연상이 됐다. 그 책에 나오는 방법들을 실천하면 어떻게 되는지를 90년간의 인생을 통해 간증한 사람의 일기를 보는 것 같은 느낌이었기 때문이다. 이나모리 회장이 전하는 성공의 비법은 사실 읽어 보면 다들 아는 이야기들이다. [원대한 꿈을 꾸어야 하고, 그 꿈을 이루기 위해 오늘 당장 남보다 더 자주 움직여야 한다. 꿈을 실현하기 위해 구체적으로 무엇을 어떻게 할지 목표를 세워야 한다. 어떻게 할지에 대해서는 스스로 끊임없이 생각해서 방법을 찾아내야 한다. 꿈을 이루기 위해 진정으로 원하고 전념을 다해 노력할 때 꿈은 비로소 현실이 된다.] 너무 오랜만에 기본적인 내용을 마주해서 오히려 낯설었다. 요즘은 이렇게 클래식한 교훈을 담은 책이 예전에 비해 많지 않다. 최선을 다해 미친듯이 열심히 살아가는 사람들의 성공 비결은 이미 너무 많은 사람들이 친절하게 수십번 수백번 이야기한 터라 더 이상 사람들이 궁금해하지 않기 때문이다. 게다가 막상 보면 마치 방송에 나와 서슴없이 비결을 알려줘서 봤더니 양념장 준비만 3일을 하는 맛집 장인을 보는 것 같은 거리감도 들고, 실천하기도 쉽지 않은 방법들뿐이라 귀가 번쩍 트이지도 않는다. 무엇보다 최선을 다해 열심히 노력해도 그만큼 대가가 돌아오지 않는다는 걸 뼈저리게 체감한 젊은 세대들에게는 잘 와닿지 않을 가능성이 높다. 계층의 고착화가 심해지는 사회에서 워킹 라이프 밸런스, 일하지 않고 돈 버는 법 같은 것들이 중요해지고, 건물주를 조물주라고 부르는 풍조가 여전한 것만 봐도 알 수 있을 것이다. 놀라운 것은 이나모리 회장이 그저 '나 때는 말이야, 요즘 젊은이들은 말이야...' 하면서 본인 자랑만 늘어놓는 것이 아니라 아흔 살이 넘었는데도 불구하고 이렇게 빠르게 변화하는 세상의 흐름을 정확하게 짚어주면서 '그럼에도 불구하고 너희들이 원하는 삶을 살아가려면 이렇게 살아야 한다' 고 조언해주고 있다는 점이다. 그렇기 때문에 더욱 그의 이야기에 귀기울이게 되는지도 모르겠다. 뿐만 아니라 이나모리 회장의 이야기에는 후끈한 열기가 어려 있다. 그의 지난 모든 삶의 여정이 활활 타오르는 열정 그 자체여서, 글만 읽어도 얼마나 힘들었을지, 얼마나 그가 인생을 충실하게 살아왔는지 다 느껴질 정도였다. 어떤 사람이 하더라도 힘들다고 그만두고도 남았을 법한, 어렵고 열악한 근무 환경에서도 이나모리 회장은 미친듯이 몰두해서 최초로 파인세라믹 개발에 성공했다. 값진 성공의 기쁨을 맛본 20대의 그 어느날 이후부터 그는 그 어떤 상황이 와도 그 전의 부정적이고 쉽게 부서지는 마인드로 돌아가지 않고 끊임없는 긍정을 연료삼아 열정을 불태웠다. 책을 읽는 내내 그 한결같은 열정에 압도되어 있었다. 그렇게 계속 타오를 수 있다는 것이, 너무 부러울 지경이었다. 이나모리 회장의 또다른 본받을 점은 뜨거운 한편 감각과 감정이 살아있는 섬세한 사람이라는 것이다. 그는 정말 사소한 것 하나도 놓치지 않고 거기서 뭔가를 느끼고 깨닫고 성장의 원동력으로 삼는 사람이었다. 모두가 어이없어하던 마쓰시타 회장의 혼잣말에도 혼자 엄청난 깨달음을 얻고, 넘어질 뻔했던 바닥에 묻은 파라핀왁스에서 불순물없이 완벽한 제품을 만들 수 있는 비법을 얻고, 집 근처 돌 틈 사이에서 피어난 풀꽃을 보고도 모든 자연은 살아가기 위해 죽을힘을 다해 노력한다는 깨달음을 얻는 사람. 온 마음을 다해 노력한 실험에서 아주 작은 성공이라도 거두면 뛸 듯이 기뻐하는 사람. 어쩌면 이렇게 사소한 것에서 감동을 받고 울림을 느꼈기 때문에 그런 작은 디딤돌 하나하나가 모여 이 사람이 그런 고생을 하고도 단단함을 유지하며 전력질주로 마라톤을 할 수 있었던 거라는 생각이 들었다. 나이가 들어서도 이렇게 모든 감각과 열정이 깨어있는 사람이 얼마나 될까? 어떻게 보면 '꼰대' 일 수 있겠지만, 이렇게 존경스러운 꼰대라면 기꺼이 뒤따르고 싶다. 이나모리 회장이 온몸을 던져 가장 단순하고 가장 뜨거운 말들로 나의 머리를 일깨워 주었으니, 이제는 내가 스스로 나의 마음의 화로에 불을 붙일 차례다.                 "
"                신입사원입니다. 부장님이 갑자기 저를 보더니 이 책을 읽으라고 해서.. 어쩔 수 없이 읽게 되었습니다. 솔직히 기대도 안 했고 살짝 원망의 맘도 있었습니다. 그런데.. 정말 한 장 한 장 읽을 때마다 다음 장이 기대되는 책이었습니다. 진짜 내가 일을 하는 이유의 근원적인 생각을 하게 되면서, 월요일이 세상에서 제일 싫고 두려웠는데. 제 맘이 바뀌고 움직이기 시작했습니다. 사무실에 앉아있는 시간이 길고 지루하게만 느껴지고 점심시간만을 기다리던 저에게 변화가 시작되었습니다. 이제는 아침이 즐겁습니다. 출근 길이 행복합니다. 일요일도 좋지만 월요일도 나쁘지 않다는 것을 알게 되었습니다. 저는 이 책을 모든 직장인들에게 추천합니다.시간 가는 줄을 모르고, 계속 읽고 손에서 책을 놓지 않게 되었습니다. 독서라는 것이 이렇게 쉽고 재미있게 이루어질 수 있어서 너무너무 좋습니다. 이 곳에서 정가보다 저렴한 가격에 구매할 수 있게 해주셔서 감사할 따름입니다. 열심히 읽고 또 다른 책 구매하러 오겠습니다. 감사합니다.                "
"                이나모르 가즈오 저자의 출판사 다산북스에서 나온 왜 일하는가 라는 책을 읽었습니다. 이 책을 산 이유는 제가 재직하고 있는 회사의 대표님이 이 책을 직원들에게 적극 추천하다 못해 구매하여 배포하고자 하였기 때문입니다. 전형적인 회사의 사장님, 대표님, 이사님이 좋아하실 듯한 내용의 책입니다. 하지만 직원들은 크게 공감을 느끼지는 못할 듯한 내용인데 어쨌건 잘 읽었습니다. 이책으로 독서토론회도 한다는데 기대가 되는군요.                "
"                우리는 대부분  열심히 일한다. 하지만 자신이 왜 일하는가에 대해서 명확한 답을 할수 있는 사람이 과연 얼마될까.특히 요즘 같이 주변에 부동산,주식,코인으로 부자되는 사람들을 지켜봐온  사람들은 열심히 일만하는데 대해 회의감마저 들었을수도 있다.이나모리 가즈오는 자신의 일생의 경험을 통해서 우리에게 이해하기 쉽게 일의 진정한 가치가 무엇인지 이야기 함으로써 왜 일하는지를 깨달토록 도와줬다.당신도 나 처럼 이 책을 읽은 다음날 출근길이 한결 가벼워지시길 기대한다.                "
"                '배움'이라는 활동이 없다보니 뭐하고 사나 싶은 생각이 문득 들었다.이 책을 읽고 곰곰히 생각을 해보았다. '배움'이 없다는 핑계거리일 수 있다는 생각이.. 일을 단순노동으로 치부하여버리니 배울 점이 없다는 판단하에 현재 삶이 '배움'이 없다고 단정지어 버린 것이다. 이 책을 읽으면서 매우 반성하게 되었다.?일본 교세라그룹의 창립주인 '이나모리 가즈오'라는 분이 쓰신 저서로 제목부터 간단하지만 어려운 질문을 던진다. ""왜 일하는가?"" 왜? why?라는 질문을 던진다. 사내에서 교육을 받거나 강의를 들을 때 항상 듣던 얘기가 있다. '무엇을?' '어떻게?' 보다 '왜?'라는 질문을 먼저 생각해라."" 이유, 목적이 분명해야 이후에 어떤 업무든 할 일이든 정립되면서 동기부여가 된다는 것이다.이 질문도 같은 맥락이다. 일하는 목적을 생각해봐야 하는 것이였다. 저자는 단순히 '먹고살기 위해서'라는 생계유지 목적을 위한 답을 듣고자 하지 않았다. 일을 함으로써 '내 인생의 발전'을 위해서 생각해보라는 것이였다. 능력치, 지위, 회사에 대한 기여 뿐만 아니라 자아성찰을 통한 내면적 발전을 위해 일을 하라는 것이였다.나를 발전시키기 위해 큰 맥락으로 일을 사랑하라, 꿈을 꿔라, 노력을 지속해라, 현재에 만족하지말고 완벽을 꿈꿔라. 창조적으로 일하라 등에 대한 조언에 대해 이야기 하고 있다.아주 받아들일 것이 많은 책이기도 하지만 호불호가 갈릴 책이라고 생각을 하였다. 결국 성공한 삶을 살았기에 자신의 경험을 토대로 조언을 하지만 과거 50년전의 성공담을 토대로 풀어나간다. 노력과 애정이 있으면 언젠가 될 것이니 안되도 계속 해라, 라는 태도와 동료직원에게 많은 희생을 강요하면서 무조건 되게 하라라는 신념은 현 시대에는 무조건적으로 받아들이기 힘들어 보인다. 게다가 MZ세대의 출현으로 더욱더 자율적 태도를 추구하는 이 사회에 완벽, 강요는 공감이 되지 않는 분도 있을 것이다.특히, 이 부분 '막연한 미래를 내다보고 걱정하기보다는 당장 내 눈앞에 있는 현실만 보기로 했다.''숲을 보지말고 나무를 보라'의 느낌이다. 장기적인 청사진보다는 단기간의 확실한 목표를 세우라는 것이였다. 지금까지 들어왔던 이야기와는 매우 이질적인 느낌이 있었다. 이 책이 경영서의 바이블인지는 알지 못하겠지만...왜 일하는가에 대해 진지하게 고민해볼 필요는 있다고 생각을 했다.?책 한마디에 ""삼성이 10년간 신입사원들에게 추천한 단 한권의 책!""이란 구절이 있는데..솔직히 잘 모르겠다...                "
                도서관에서 빌려서 봤는데 내용이 도움이 많이 되서 구입했습니다.차분히 잘 읽으면 도움될책 같아서요. 방구석에서 비즈니스 해보는게 소원입니다 ^^ 밑줄 쫙쫙 그으며 읽고싶어요기존에 스마트 스토어를 운영중이였으나 생각보다 쉽지 않았습니다 다시 시작하는 마음으로 방구석 비즈니스 도전 합니다실천하지 않는지식은 똥입이다. 이렇게 말하시는 저자의 내용에 적극 동감입니다 지금 고민마시고 실천해봐야겠어요 저처럼 고민하시는 분들 모두 화이팅 입니다                
                교보문고서 스마트스토어책 관련 몇권을 꼼꼼히 보다 이책의 목차와 내용을 보고 이거다싶더군요! 일부러 나온 보람이 있구나 생각했고 당장 집어들고 집에와서 훑어보니 이대로만 따라하면 대겠단 생각 들었어요~~ 잘 따라할수있도록 그림삽입도 잘 되어있고 저자의 카페도 있는듯해 커뮤니케이션하기도 좋은듯 한거 같아요!시작이 반이라고 이책과 함께 한발 내딛어보고자 합니다! 좋은책 만들어주셔서 감사합니다 ^^                
                지루한 회사생활에 돈은 항상부족하고 월급만으론 부족한세상에서 한줄기 빛과같은 책일거같아 책소개보고 바로질렀습니다 열심히 따라해보고 공부해서 저도 월 1000만원 인생살아보고싶네요 아직 읽어보진않았지만 저도 이제 인생 제 2막을 살아야겠다라는 생각을 하고 있어서 물론 한권의 책으로 모든게 다 될거라고 생각하진 않지만 이책을 읽고 얼마나 내것으로 만들어서 나만의 사업을 할 수있을지 기대됩니다 열심히 해보려구요 독파할때까지 반복학습하겠습니다!!! 이런기회를 주신 저자님께 감사드립니다                
