"                우리가 알고 있는 바이러스는 정말로 끔찍한 치명적인 질병의 원인으로 알고 있습니다. 그런데 이 도서의 제목 &lt;빌 게이츠 넥스트 팬데믹을 대비하는 법을 보자마자 문득 요츰 아직도 한창인 코로나 바이러스 때문에 전 세계적으로 많은 비상이 걸려 이슈가 되고 있는 기억이 났습니다. 이 도서의 소개를 찾아보니 간단하지만 핵심적인 몇 가지 예방법과 행동요령을 습관화하는 것만으로도 바이러스 위협에서 벗어나 나 자신뿐만 아니라 우리 가족의 건강을 책임질 수 있는 방법들을 알차게 소개를 해주고 있어서 환절기로 감기에 고생 할 수 있는데 우리 가족의 건강을 책임질 정말로 꼭 필요한 생활 지침서가 될 도서가 아닌가 생각이 들었습니다.""질병 치료는 인간에게 새로운 일이 아니다. 식물 뿌리, 허브, 기타 자연 재료를 치료제로 사용하는 관행은 고대부터 시작됐다.""읽는 동안 가장 특이했던 것들과 인상 깊었던 부분들이 각각의 바이러스 별 특징을 설명하고 질병의 성격에 맞는 예방법을 조목조목 짚어주고 있었습니다. 신종안플루엔자(H1N1), 조류독감, 사스, 곤충에 의한 질병들, 에불라와 에이즈로 우리를 두렵게하고 위협을 하고있는 질병들에 관해 설명해주고 있었습니다. 각 질병들이 발병하는 원인과 급속도로 퍼지기 시작한 이유부터해서 어떻게 이러한 병들이 우리에게 위협을하고있고, 어떻게 지속이 될것인지 자세하게 설명해주고 있었습니다. 두번째 파트에서는 이러한 질병들을 예방하는 방법에 관해서 설명해주고 있고, 개개인이 예방할 수 있는 방법 또한 설명한는데 놓치지 않고있어 많이 유익했던것 같았습니다. 특히나 요즘에 겨울이 될때마다 경고의 메세지를 전해주는 조류독감의 경우에는 2009년 돼지독감으로 알고 있다가 조류독감이었다는 사실에 많은 충격을 주었던 감기로 아직도 노약자들에게는 위험한 독감으로 알려져 있습니다. 계절에 따라 이동하는 야생 철새들 때문에 국경이 없는 질병으로 전 세계를 공포로 몰았던 과거의 기억때문에 올 겨울에도 심하게 예의주시하고 있는 정부의 모습을 매스컴을 통해 보아오고 있습니다.코로나19 직전 어떤 무역이라도 수비지 않았기 때문에 GDP가 역으로 갔던 1년을 흘러보내면서 많은 업체들이 이를 극복하고자 노력한 끝에 비대면 시대에 맞춰서 교역을 할 수 있는 활로를 마련하여 팬데믹 이전 수준을 유지할 수 있었습니다. 게대가 인터넷의 발전이 5G 시대를 넘어 서는 경계에서 스마트 폰으로 세상에 폭발적으로 늘어나고 있는 콘텐츠들로 인해서 히스테리와 의견 충돌 같이 부정적인 사고들의 표현이 넘처나 위험할 수 있음을 강조하고 있습니다. 코로나19의 방역에 주체가 되었던 정보통신망의 활용은 더 우리 공동체를 대면할 때 우리는 긍정적인 에너지로 넘쳐나야 발전하고 성장할 수 있는데, 부정적인 메세지들이 넘쳐날 때 희생자가 발생하고 성장이 후퇴할 수 있다는 사실을 우리는 비대면 시대 속에서 잘 분별해야 겠습니다저와 같이 이 도서 &lt;빌 게이츠 넥스트 팬데믹을 대비하는 법을 읽으면서 코로나19로 인한 질병없는 나, 나의 가족을 꿈꾸는 사람들이 많아질거라 생각이 들었습니다. 아이를 키우는 가정이나 질병과 바이러스에 대해서 관심이 많아 항상 존재하는 바이러스를 잘 대처하고 이겨나갈 수 있는 방법을 찾아보고 계신 분들께 권하곳 싶은 도서입니다.                "
"                어제 코로나 확진자는 6700명선이었습니다. 그러나 올해 3월달에는 하루에 전국기준 30만명이 넘었습니다. 저도 그때 아쉽게도 확진이 되어서 일주일가까이 고통을 당했습니다. 지난 2년간 한국뿐 아니라 전세계가 팬데믹으로 고통을 받았습니다. 그리고 현재는 많이 안정되었죠. &lt;빌게이츠 넥스트 펜데믹을 대비하는 법은 이번 코로나로 배운점과 앞으로 어떻게 미래에 팬데믹을 대비할까를 세계적인 경영구루 빌게이츠의 정보력을 바탕으로한 혜안을 듣는 귀중한 기회였습니다.저자는 전 MS창업자 빌게이츠입니다. 올해 68세시고요. 지금은 MS의 기술고문을 맡고 계십니다. 우리가 매일쓰는 윈도우와 워드, 파워포인트를 생산해서 판매를 하셨죠. 지금은 MS경영에서는 거의 은퇴를 하시고 빌게이츠재단을 통해 세계 빈민구제와 복지에 기여를 하고 계십니다. 이 책을 통해서 빌게이츠 재단이 어떻게 재단을 운영하면서 자금을 집행하는지 간접적으로도 알수있는 기회도 되었습니다.전염병에는 아웃브레이크와 에피데믹과 팬데믹이 있습니다. 아웃브레이크는 특정지역에 국한된겁니다. 몇년전 한국을 공포로 몰아넣었던 메르스가 있습니다. 다른 나라보다 한국에만 국한 된거라 아웃브레이크라고 할수있습니다 이것이 대륙으로 확산되면 에피데믹이고 전세계로 코로나처럼 퍼지면 팬데믹이라고 합니다. 앞으로도 지역전염병이 많을 겁니다. 그것이 전세계로 번지는 팬데믹이 되지 못하게 하는 것이 인류의 실험일겁니다. 그래서 어떻게 하면 아웃브레이크상태에서 팬데믹으로 확산하지 못하도록 노력하는 것이 할일이라고 합니다.저자는 이번 전염병을 통해 초기통제가 잘된 아시아몇개국의 공통점을 알려줍니다. 신속검사, 양성환자를 격리, 그리고 국경전파를 추적하는 나라들이 초기 방역에 성공을 했다는 겁니다. 사실 아시아 몇개국을 제외하고는 유럽과 미국은 봉쇄는 거의 하지 않았습니다. 물론 나라마다 너무 심하면 사회적 거리두기를 지역봉쇄로도 진행되었지만 기본적으로 백신을 맞는 권리와 자유권에대한 논쟁이 심화될 정도로 확산이 컸습니다. 서구는 아시아와 달리 권위적이 아니어서 마스크를 법제화할수는 없었을 겁니다. 이로 인해 한국은 올해 들어서 유럽에 비해 많은 확진자를 낳았지만 코로나19중에서 치명율이 떨어지는 오미크론에서 대규모 감염사태로 서구에 비해 치명율이 낮았던 것도 사실입니다. 그리고 다음 전염병일수있는 원숭이두창은 지금 위험도가 올라가고는 있지만 코로나19같은 거대한 피해는 피할 수있을 겁니다.이번 팬데믹의 분수령은 WHO사무총장이 국제적 공중보건 비상사태를 선언한 2020년 1월 30일을 기준으로 봅니다. 이때를 깃점으로 전세계국가들이 총력대응을 시작했다는 거죠. 이책을 보면서 놀란점은 아프리아서는 부검을 거의 하지 않는다는 겁니다. 병의 원인을 밝히기 위해서는 무조건하게 되어있다고 생각하는 부검을 아프리카에서는 터부시한다는 거죠. 그런 시설이 없는 것도 일조를 했죠. 그것을 피해서 원인조사를 위해 최소침식부검을 시행합니다. 이를 통해 아프리크의 전염상태를 알수있게 되었습니다.지난 2년을 통한 100년만에 맞는 전염병은 세계보건에 대한 많은 논의를 양산했습니다. 현재도 진행중이지만 빈익빈부익부의 느낌은 있지만 어떻게 대응을 해야 하는지에 대한 모델은 알게 되었습니다. mRNA처럼 혁신에 노력을 해야 하며 GERM(글로벌전염병대응)팀을 구축하고 질병감시시스템을 개선하고 보건체계를 강화해야 아웃브레이크로 막을 수있고 합니다.이번 팬데믹으로 인해 감염분야는 획기적인 발전을 했고 저자도 많은 노력을 했다고 합니다. 사회는 감염으로 인해 디지털에 매우 빠르게 발전을 했습니다. 현재 코로나가 미국에서 재확산되고 있습니다. 한국도 4차백신접종율이 점차 높아질겁니다. 이것이 이제 선진국대열이 들어간 한국만의 상황이 아니라 아프리카 저개발국가까지 모두 안전한 지구가 만들어졌으면 합니다. 그것이 저자와 저와의 같은 꿈일듯합니다.본 도서는 출판사로부터 무상으로 지원받아 주관적인 리뷰를 했습니다.                "
                반복해서읽을 가치가있다최근 몇달동안 유튜브를 통해 부에 대해 돈에 대해 생각에 대해 많이 배우려고했고 그러다 이책까지왔다읽어보면 내가여태까지 배웠던 내용들을 쪽집게 강의처럼 요약해논 느낌이들었다 그래서 이책만 지금까지 5권 이상을 샀고 주변에 부자가되길 바라는 사람들에게 책선물을했다하비에커에대해 더알고싶어서 검색을해봤지만 이책말고늘 별다를 것을찾아내지못해 아쉽다                
"                바닥 심해까지 들어갔다가 백만장자가 된 외국인 남자가 쓴글.특히 이런 내용의 외국인이 쓴 책은 동감이 좀 힘든부분이 있는데, 왠지 이글은 뻔하지만다시 나는 할 수 있다! 라고 마음을 다잡을 수 있는 책이다.막연하게 부자가 되고 싶은 마음은 있지만 현실속에서는 다 부질없다고 포기하지만이 책을 읽고서 다시 도전하고 마음을 다잡고 시작하는 계기가 되었다.조금씩 나를 움직이면 10년 후에는 백만장자 아니 억만장자가 되있겠지?                "
                이책은 성공과 부자로가는 요약집이다자기계발서의 시초라고할수있는 생각하라부자가되라엄청난 인기를 얻었던 론다번의 시크릿조성희대표님의 뜨겁게 나를 응원한다를 먼저 읽고 이것을 읽게뫴다이책은 위에서 읽었던 책들의 엑기스를 뽑아서 완성된 요약집이다그리고 구체적이다 행돈을 요구한다 말하는게 이해가되고 또읽고싶은생각이들게만드는 매럭이있다                
"                매년 11월경KB경영연구소에서 발행하는 ""한국부자보고서""를 보면, 한국 부자란 ""10억 이상의 금융 자산을 보유한 개인""으로 정의하고 있다. 2021년 보고서를 보며 그리고 이러한 한국 부자가 해마다 약 10% 상회하는 높은 증가율을 나타내고 있다는 정보를 접하며.. 그리고 내 상황을 살짝 견주어보며그동안 미뤄뒀던 ""백만장자 시크릿""을 꺼내어 읽어보게 되었다.돈이 그리고 부의 정도가 행복을 얻기 위한 절대 기준은 아니라고는 하지만, 개개인이 원하고 바라는 바를 누리기 위해서는 돈을 필요로 하는 물질 세상에서의 만족 또한 불가피한 부분이라고 생각한다. 모두가 부자가 되기를 꿈꾸는 것처럼 말이다.이 책은 두 파트로 나누어져 있는데, 1부에서는 경제 청사진을 수정하기 위한 4가지 핵심 전략을 소개하고 있으며, 2부에서는 부자 마인드로 채우고 부자가 되기 위한 17가지 행동지침 매뉴얼을 제시하고 있다. 왜 부를 끌어당기는 부자 마인드의 바이블로 극찬을 받고 신뢰받은 필독서인지 공감할 수 있었다.20대에 이 책을 접했다면은..이라는 아쉬움이 나 역시 들었지만, 지금이라도 이 책을 만나게 된 것을 행운이라고 생각하며 읽어 내려간 책이었다.                "
                소비심리와 관련한 책! 브랜딩과 소비에대해 관심을 갖고 어떤 책을 읽어볼까 하던 중준호의 책장에서도 발견했던 뇌 욕망의 비밀을 풀다를 선택했다한국사회의 소비심리는 '유행'에 기반되어 있다고 생각한다개인주의 사회인듯 보이지만 사회적이고 남의 시선을 가장 많이 의식한다는 내용을 읽고어쩌면나에게도 해당하지 않을까 의문이 들고 생각하게끔 만들었다그 대답은 yes . 당연하다고 여겨지고 나의 주관이라고 여겼던 것이 어쩌면 뇌에서부터 나온근원적인 현상이라는 점을 읽고나니 연관성에 흥미롭게 읽어나갈 수 있던 책이었다                
"                이 책은 뇌신경학을 마케팅과 연결해서 해석한 책이다.다소 새로운 접근법이었으며, 과학적인 실험 결과들을 근거로 무장해서소비자의 심리와 마케팅 방법에 대해 풀어내고 있다.기존 서적들이 단순히 사회과학적 접근을 통해,통계나 심리 실험을 기반으로 해서 마케팅을 풀어갔다면,이 책은 뇌과학이라는 다소 무거운 방식으로 접근을 시도한다.그래서 일반인에게 익숙치 않은(그럼에도 저자분은 쉽게 쓰기 위해 무진장 노력하신듯...)용어들이 눈에 들어온다.초반에 책을 읽어나갈 때는 다소 지루함과 집중력이 흐트러지기도 한다.초반에 열거한 과학적 지식들과 구조들은 책의 후반부의 소비자의 행동에 대한 설명과마케팅 시 활용할 수 있는 방법론으로 연결되어진다.책에는 다양한 사례와 도표 등이 많이 포함되어 있어서..초반부의 살짝 지루함을 잘 넘긴다면...분명 후반부로 갈 수록 많은 인사이트를 얻을 수 있는 책이다.책은...결론적으로 우리는 의식을 통해 무언가를 자유의지로 선택한다고 생각하지만,이는 착각에 불과하며 우리의 뇌는 무의식중에 선택을 하게 된다는 것이다.그런 무의식이 어떻게 형성되고 성별, 나이 등에 따라 어떻게 달라지는지를구체적으로 분석하고 이를 분류해서 설명해주고 있다.저자는우리 뇌는 크게 자극 시스템, 균형 시스템, 지배 시스템의 영역이 있으며, 이 세 영역의 흔들림과 경중에 따라 성향이 결정된다고 보고 있다.이 부분을 파고들어 마케팅에 접목할 경우 무엇을 해야할 지를 설명하고자 한다.이 책은...마케팅 관련 담당자에게 많은 도움이 될 것 같다.그러나 일반인들에게도 지혜를 준다.인간의 뇌가 이렇게 생겨서....상황에 따라 어떻게 하는게 맞을지에 대한 지식을 얻어갈 수 있다고 생각된다.                "
"                벤츠를 사고 싶은데...정말 이 차가 내게 필요한 물건인지? 아닌지? 몇 달째 고민을 하고 있다.벤츠에 대한 나의 욕망! 이 책을 읽으면 그 답을 찾을 수 있을까우리의 뇌 속에서 무의식적으로 일어나는 일들은 우리가 경험하거나 인지하는 것보다 훨씬 더 광범위하게 소비행동과 구매패턴에 영향을 미친다. 우리는 자신의 의지에 따라 자유롭고 합리적인 소비를 할것이라는 믿음을 버려야 한다. 감정시스템에는 빅3가 있는데 균형시스템, 지배시스템, 자극시스템이다.균형시스템에는 안전에 대한 욕구가 있고자극시스템에는 체험에 대한 욕구가 있다.지배시스템은 권력에 대한 욕구로써 싼 물건을 찾아다니는 사냥꾼의 원동력인 포획·사냥모듈과 뇌 중추를 활성화시키는 싸움모듈, 인간의 근원적 욕구 성욕이 머릿속에서 권력투쟁을 일으킨다. 그 순간 어느 감정시스템이 이기느냐에 따라 구매가 결정되는 것이다. 또한, 상반된 욕구들의 긴장관계에 쾌락주의적 긴장과 금욕주의적 긴장이 있다. 혁명적긴장 vs 보존적 긴장, 이기주의적 긴장 VS 이타주의적 긴장. 벤츠를 떠오릴 때나의 쾌락적 긴장과 금욕적긴장이 충돌한다. 요즘은 쾌락적 긴장이 이기는 추세이다.  아이라이너가 연필보다 비싼 이유아이라이너와 연필은 대단히 유사하다. 차이점이라면 아이라이너는 피부에, 연필은 종이에 사용한다는 점이다. 제조비용 역시 크게 차이나지 않지만 아이라이너가 2배정도 비싸다. 그렇게 비싼 돈을 주고 살 만큼 아이라이너가 중요한 이유는 무의식에서 알려주는 신호 때문이다. 배란기 직전의 여성은 눈가의 피부색이 약간 어둡게 변한다. 이는 임신할 준비가 되어 있음을 남성에게 알려주는 신호이다. 눈 주변이 어두워져 임신 준비가 되었음을 알리는 여성을 가장 매력적이 여성으로 선택하는 남성들은 그런 선택의 이유를 모른다. 아이라이너는 성육모듈을 활성화시키지만 연필은 기껏해야 손가락을 활성화시킬뿐이다.  우리가 커피를 즐기는 이유커피는 사람들에게 즐거움을 준다. 다양한 품종과 레시피로 선택의 폭을 넓혀주면서 광범위한 즐거움을 선사한다(향유동기). 게다가 커피는 활력을 불어놓고 생기를 돋게한다(활성화동기). 어떤 사람들에게는 커피는 경쟁자보다 더 많은 성과를 내기 위해 마시는 각성제가 되기도 한다(관철동기). 어떤 사람들에게 커피 한 잔은 긴장을 이완시켜주는 휴식을 의미하기도 한다(균형동기). 나를 위한 작은 사치, 개성 있는 라이프스타일의 표현, 품위있는 라이프스타일의 표현, 하루 혹은 한주 단위로 거행하는 의식, 사회적 접합제로서 마시는 커피 등 커피는매우 다양한 의미영역에 전체를 커버한다.  합리성, 적은 돈으로 많은 즐거움 사기합리성에 대한 기준은 사람마다 다르다. 기분 전환과 자극을 중요하게 여기는 소비자의 경우 합리성은 자극 시스템을 얼마나 강하게 자극하느냐로 결정된다. 그들은 최소한의 돈으로 흥미진진한 경험을 최대한 많이 하면 즐거워한다. 반대로 금욕주의자는 돈을 전혀 쓰지 않았을 때 자신의 금욕행위로 점점 불어나는 통장 잔고를 확인할 때 행복해 한다. 사람들은 저마다 자신의 방식대로 즐거움을 최적화, 최대화한다. 나는 과연 금욕주의자일까? 기분파일까?  스포츠에 대한 관심도사람들은 스포츠를 통해 자신이 얼마나 강한 사람인지 증명하는 동시에 그 과정에서 무언가를 체험하려 한다. 스포츠에서 높은 가치 지수를 보이는 것은 실행가 유형과 쾌락주의자 유형이다. 실행가 유형은 스포츠를 그들의 강인함을 입증할 기회로 간주한다. 반면 쾌락주의자 유형은 스포츠가 지닌 즐거움과 오락으로서의 가치를 중요시 여긴다. 스포츠 활동과 가장 거리가 먼 집단은 조화론자로 이들은 긴장하며 움직이는 것과 안락한 소파에서 쉬는 것 중 하나를 선택해야 한다면 주로 소파를 선택한다. 난 운동을 좋아하는 타입이 아니지만 그 중에 하고 있는 거라면 등산, 골프, 걷기가 있다. 등산은 나의 인내심, 목표의식을 테스트해보는 성취의욕이 동기부여였다면, 골프는 남들에게 보여주기 동기부여였다. 걷기야말로 즐거움으로 하는 것인데 운동에 있어 나의 동기는 그저 조화론자인 것 같다.  정원용품에 대한 관심도소비에 금용적인 태도를 보이는 규율숭배자의 지갑을 열게 할 만한 상품이 과연 존재할까? 하는 의문에 정원용품이 있다. 규율숭배자와 전통주의자들에게 있어 정원은 지상낙원이다. 그들은 정원용품을 사기 위해 기꺼이 지갑을 열어 돈을 지출한다. 물론 이때도 도를 지나칠 정도로 낭비하는 법은 없다. 반면 쾌락주의자에게 정원이란 지루함의 대명사로 정원은 그들의 자유를 박탈하는 대상이나 마찬가지이다.  주요 호르몬들의 하는 일남성 호르몬 및 여성 호르몬이라는 명칭은 정확하지 않다. 단지 호르몬 농도에서 차이가 날뿐 남성과 여성 모두에게 존재하기 때문이다.절약하고 있다는 느낌은 특정 욕구의 성취를 의식적으로 포기할때만 느껴진다. 50대는 포기와 희생을 스스로 인지하는 못하는 세대이다. 자극시스템과 지배 시스템이 개입된 30대의 욕구보다 약하기 때문에 노년층을 자신이 절약하고 있다는 느낌을 느끼지 못한다  청과물 코너가 매장 입구에 있는 까닭자신이 잘 모르거나 신뢰할 수 없는 상황에 놓였을 때 고객은 뇌에서 최초의 자극과 정보를 받아 들은 후, 그걸 다음 자극에 대한 판단의 틀로 삼는다. 매장 입구에 깔끔하고 멋지게 배치된 청과물 코너는 신선함, 건강함을 무의식적으로 고객에서 전달한며, 화려한 컬러와 다양한 원산지의 맛과 향은 자극 시스템을 활성화시킨다. 매장입구에서 어디로 가야할지 몰라 방황하며 쇼핑 스트레스를 받고 있는 고객에게 균형시스템을 만들어주며, 자기가 찾는 물건이 어디 있는지 잘 알고 있는 직행 단골고객에게는 신선함과 즐거움을 자극하기에 바쁘게 움직이던 고객들의 발걸음을 다소 느려지게 한다. 나는 정말 벤츠를 사고 싶은 걸까? 그 보다 내가 벤츠를 살만한 능력이 되는가나의 뇌에서는 과연 어떤 지배시스템이 싸워 이길까“the having“에서 말하듯 내가 이 물건을 소유하였을 때 느끼는 충만함, 행복함이 어떤가를 집중해보고자 한다. 나의 오래된 소망. 성취욕, 가심비. 난 역시 벤츠다.                "
"                후배가 한 번구경 가보라고해서 페이스북에 들러 본 것이 7-8년 전인가 보다.그 땐페이스북으로종종 보는글을 보며 몇 가지 궁금증이 있었다.첫 번째는왜 쓰는가?두 번째는사회적 위치에서 SNS에 긴 글을 통해 생각을 열어 소통하는 것은 부담스럽지 않을까? 이런두서없는생각을 했었다.내가 블로그를 한 목적은 아주 단순하다. 내게 떠오르는 생각이스쳐 지나가기만하지 않도록 쓰기 시작했다. 오로지 나를 위해서 시작한 셈이다. 왜냐하면 스스로 덜떨어졌다고 생각했기 때문이다. 글을 쓰면 증거가 남고, 내가 다시 고칠 수 있는 본보기를 만들고. 그러나 무엇보다 내가오타 대마왕에맞춤법이 형편없고,띄어쓰기는거침없을 뿐 아니라 반복적으로 틀린다는 사실을 깨달았다. 나를 위한 기록이었지만 지금 블로그의 특성상 누가 본다고개의치않는다. 더 좋은 의견을 배울 수 있고, 내가 잘 모르는 분야에 대한 조언도 들을 수 있다. 그리고 내가 기록들이 내가 존재하는 분야를 도전하는 젊은 사람에게 도움이 될 때가 있다는 것만큼 즐거운 일도 없다. 모 채용사이트에서 블로그를 수 년째 퍼가도록 허용하는 이유다.작가의 페이스북은 내 주관적인 입장에서 조직에 관련해 선험자가 말하는 case study에 가깝다. 주제의 범위가 있다고 생각하지만 사회생활을 하고, 조직생활을 하며 리더십을 키우려고 노력하는 사람들에겐판에 박힌교과서라기 보단 살아있는 이야기다. 자신의 것을 베풀어 누군가가 더 나아질 기회가 되는 것이고, 작가에게는 자신의 생각을 펼치고 사람들의 생각을 통해서 새로움을 받아들이는 기회다. 책의 구성도 그 연장선상에 있다.얼마 전거친 상사를 대하는 법에 대한 글이 올라왔다. 어쩌다 보니 거친 상사들을 자주대하다 보니그들을 대하는 법도 중요하지만 그 과정에서 나를 잃지 않는 법이 더 중요하다는 사실이 생각났다. 내 생각을 담아 댓글을 쓰고, 항상 화답을 주는 작가를 보면 한 번도본 적없지만 자주 찾아보는 네트워크 이웃이다. SNS에서 말하는지자 댓글,인자 답글이란말을이럴 때써야 하나?책의 표지에 격(格)이란 글씨가 있다. 어떤 분야의 수준, 인품의 수준은 많이 안다고만 다다르는 곳은 아니다. 사람, 상황, 시간, 장소, 지위에 맞는 앎이 필요하다. 더 나아가 그런 나의 앎이 세상의 많은 사람들까지 품어 낸다면 많은 사람들의 지지와 존경을 얻게 된다. 글을 통해 타인에게 물 흐르듯 흘르고 다시 새로운 변화를 받아들인다는 것은 사실 쉬운 일은 아니라고 생각한다. 꾸준히 하고 있다는 것은 삶이 소중한 시간을 담아 무엇인가를 만들어가는 일이다. 그것이 하나의 가치라 생각한다.인생의 꽃길이 오길 기다리지만, 내가 걸어 본 길을 통해서 누군가 걷고 싶은 꽃길로 갈 도움을 주는 것, 그것은 일에서도 격을 말하지만 삶에서도 좋은 격이라 생각한다.#신수성#일의격#턴어라운드 #페이스북 #조직 #리더십 #독서 #khori 일의 격신수정 저턴어라운드 | 2021년 07월                "
