"                드뎌 기다리던 입지 센스가 도착했습니다~^^처음 받아보자마자 엄청난 두께에 깜놀!!!부동산 책이 이렇게 두꺼운건...첨봤어요 ^^;;;왜이리 두꺼울까.... 하고 뒤를 봤더니 또 엄청난 부록이!!!부록을 보며 감동, 또 감동......어찌 이렇게 알차게 눌러담으셨을까요 훨훨님~^^직접 그 많은 곳들을 다~~ 가보고, 그러면서 익힌 것들을정말 아낌없이 나눠주신다는 느낌을 받았습니다.이 부록만 갖고도 수도권 전부를 임장 다닐 수 있을것 같아요.저평가 아파트, 대장 아파트 다 나와 있어서 공부하기도 너무 좋을것 같고,재건축 재개발 구역은 진행 단계와 세대수까지 나와 있어서 얼마나 좋던지요.정말 너무나도 유용한 부록입니다.책을 어제 오후에야 받아봐서 일단 제게 필요한 3부, 갈아타기부터 정독했어요.사실 좀 복잡한 내용이 많아서 술술 읽히기보단꾹.꾹 줄을 치며 읽어야 하는 내용들이었지만 ^^;;;;그만큼 유용한 정보가 정말 한가득이에요.저같은 부린이는 몰랐던 이야기가 너무나도 많았습니다.....글 제목이 고수의 갈아타기, 였는데 정말 고수들의 비법이더라고요. ^^강의로 담아도 될 것 같은 내용을 이렇게 책으로 다풀어내 주셔서 감사합니다. ^^앞에도 내용이 너무 좋은 것 같아요.지역 정리가 아니라, 이렇게 비법을 다 쏟아낸 부동산 책은 첨 봅니다. ^^우리 언니 주려고 한 권 더 사려고요 ㅎㅎ잘 읽겠습니다~                "
"                인플레이션에서 살아남기저: 오건영출판사: Page2 출판일: 2022년 5월20일역사상 유래가 없는 양적완화 나아가서는 질적완화까지 단행되면서 시장에는 유동성이 과다하게 공급되었다. 2008년 금융위기에 이어 코로나 사태로 인한 경기침체를 막고자 이러한 정책이 실시된 것이다. 그에 따라서 부동산과 주식과 같은 자산가치는 급상승하였고, 연준 및 각국 중앙은행은 낮은 금리를 유지했다. 채권투자도 좋았고, 자산투자도 좋았다. 세계는 마치 잃어버린 30년의 일본을 보면서 디플레이션에 빠지지 않기 위해서 총력전을 기울인 것 같았다.이 책의 저자처럼 70년대의 안일한 인플레이션 대응에 이은 폴 포커의 긴축정책까지 과거로 거슬러 올라갔다. 최근에 있어서 인플레이션은 조짐은 있었지만, 심각한 위협의 수준까지는 되지 못했다. 연준에서 경기과열을 우려해서 금리를 인상하려는 움직임을 보이면 눈 녹듯이 인플레이션은 자취를 감췄다. 코로나 사태를 극복하기 위해서 트럼프 및 바이든 행정부는 엄청나 규모의 경기부양책, 지원책을 펼쳤다. 그러나 근 10여년간 심각한 인플레이션 조짐이 없었기 때문에 연준의 대응은 다소 안일한 측면이 있었다는 것이다.최근의 공급망 문제로 인한 인플레이션의 유발요인도 있다. 세계화로 인해서 각국은 일종의 분업체계를 형성했으나, 코로나 사태로 인한 봉쇄조치 등으로 인해서 한 국가에서 문제가 발생하면 전체적인 공급망에서 차질이 불가피해지는 것이다. 특히, 중국의 ‘제로 코로나’정책으로 인한 엄격한 봉쇄조치, 미국과 중국간의 패권경쟁은 이러한 사태를 심각하게 만들었다. 한편, 과다한 유동성으로 인한 자산가치 상승은 조기은퇴를 정부의 직접적인 지원금은 사람들이 일자리로 돌아가지 않는 결과를 초래했다.근 40년만에 찾아오는 인플레이션 위협은 향후에 어떻게 전개될 것인가? 연준이 다소 안일한 초기 대응으로 일관했지만, 인플레이션 조짐에 대해서 겸허하고 신속하게 대응하기로 했다. 따라서 금리인상을 통한 유동성 회수에 나설 것이라는 것은 기정사실이다. 그러나, 인플레이션에 대응하기 위해서 과도하게 금리를 인상할 경우에는 경제성장에 심각한 문제를 초래할 수 있다. 연준의 금리인상은 달러강세를 이끌며 신흥국 경제에 부정적인 영향을 끼칠 것이다.투자의 관점에서 본다면 어떻게 할 것인가? 저자는 거시적 측면에서 어떤 투자가 옳은 것인지 안내한다. 일단 이러한 시기에서는 몰빵투자는 지양해야 하며, 분산투자를 해야만 한다. 우리가 인플레이션이 없다고 한다면 간단하게 고성장 저물가, 저성장 저물가의 2가시 시나리오에 따라서 투자를 결정하면 되었다. 그러나 인플레이션은 고성장 고물가, 고성장 저물가, 저성장 고물가, 저성장 저물가라는 4가지 시나리오에 대응해야 하는 숙제를 준다.우리가 투자의 종목을 주식, 채권, 원자재로 나눈다면, 저자는 일단 주식은 고성장 시기에 유망하다고 본다. 경제성장의 과실이 주가에 반영된다고 해석하면 될 것 같다. 채권은 저물가 시기에 유망하다. 채권은 일반적으로 금리가 올라갈수록 채권가격이 하락한다는 것을 본다면, 고금리의 인플레이션 시대에는 수익이 좋지 못할 것이다. 원자재는 고물가 시기 즉, 인플레이션 시기에 대응 가능하다. 금과 원유와 같은 상품이 대상이다. 여기서 추가적으로 최종적인 안전자산이라고 할 수 있는 달러이다.투자라는 것은 거시적인 측면의 변화를 읽을 필요성이 많다고 생각한다. 대체적인 방향성에 대해서 알고 난 후에 미시적인 것에 집중해서 수익을 내는 것이 필요할 것이다. 공감되는 부분은 많았으나, 실제로 향후에 인플레이션은 단기적이고 일시적으로 나타난 현상으로 볼 것인가는 생각해봐야 한다. 나 역시 저자와 같이 연준의 기민한 대응으로 인플레이션을 조기에 잡기 위해서 노력할 것이고 그렇게 되지 않을까 기대해본다. 하지만 찰스 굿하트와 마노즈 프라단의 ‘인구 대역전, 인플레이션이 온다’가 생각난다.사실 근 40년간 인플레이션이 자취를 감추고, 디플레이션까지 걱정할 정도였다. 그 근본적인 원인은 무엇이었을까? 이전에 읽었던 책에서 누군가 워렌 버핏에게 미래를 예측하기 위해서 만약에 한가지 데이터만 원한다면 무엇을 선택할 것인가 물은 적이 있다고 한다. 그 때 그는 아무런 주저없이 인구 동향이라고 했다. 인구는 앞으로 일어날 미래에 대한 가장 중요한 단서이다. 내가 말하고 싶은 것은 가장 중요한 것은 인구변화라는 것이다. 그것은 장기간 계속된 디플레이션을 인플레이션으로, 저금리에서 고금리로, 고령화로 인한 세금부담, 부진한 경제성장의 그 모든 배후에 인구변화가 있다는 것이다.근 40년간 중국과 동유럽의 세계 무역체제로의 통합, 베이비 붐 세대의 노동시장 진입, 부양인구비 개선, 여성 고용증가로 인해서 사상 최대의 긍정적인 노동공급이 있었다. 이런 결과로 인해서 이자율 하락, 자산가치 상승, 그리고 유쾌하지 않은 불평등을 심화시켰다. 그러나, 우리가 생각해볼 것은 앞으로 중국과 동유럽의 역할을 수행할 곳이 있는가 있다. 인도와 아프리카가 그 대안이 될 것인가? 그러나 인도의 행정력 부재, 아프리카의 불행한 상황을 생각해보면 그런 역할을 기대하기 어렵다.우리가 앞으로 살아갈 다음 30~40년은 지금과는 다른 요소들 즉, 인플레이션이 일반적인 것이 될 것이다. 따라서 이러한 시기를 살아가기 위해서는 어떠한 전략이 필요할 지에 대해서 우리는 통찰력을 얻을 필요가 있을 것이다. 이 책은 시사를 다룬 책이므로 가능한 빨리 읽어보길 바란다. 이런 책의 특성 상, 몇 개월만 지나더라도 그 내용이 과거의 것이 될 수 있으므로.                "
                한권의 책에 핵심만 정리하셔서 지금 우리가 처해있는 이 환경에 대해 너무나 똑 떨어지는 설명을 해주셨습니다.세계 경제흐름 또한 잘 읽고 계시며 몇개월 앞선 상황까지 간과하고 있다는 통찰력에 박수를 보냅니다.경제관념에 대한 마인드가 굉장히 열려있음을 글을 통해 읽을수 있었습니다.이책을 읽는 독자들이 이책을 왜 선택한지에 대한 명료한 답을 주시면서 독자들의 레벨또한 알고 계셔서 적당한 타이밍에 쉽게 어려운 정의에 디테일 하게 잘 설명해 주셔서 시간가는줄 모르고 읽었습니다.더 많은 책들 내어주셨으면 합니다.                
"                최근 우리의 삶에서 인플레이션은 더이상 낯설지 않은 단어가 되고 있다. 하다못해 평일의 저녁 뉴스를 조금만 시청해보아도 먹거리부터 원자재까지 다양한 자원의 물가가 전래없이 급격하게 오르고 있다는 기사를 접할 수 있다. 이 도서는 우리의 일상에 밀접하게 연관된, 더이상 피할 수 없는 인플레이션의 압력에 대해 다루고 있어 오늘날을 살아가는 현대인이 한 번쯤은 읽어야 할 것으로 보인다.특히 러시아-우크라이나 전쟁에 따른 최신 정세와 바이든 대통령 당선에 따른 미국 경제흐름 변화도 도서의 내용 속에 반영하는 등 최신 실생활에 직결된 정보를 다양하게 다루고 있기 때문에, 시간의 흐름을 크게 타지 않고 원론적인 이야기만 하는 개념서보다는 좀 더 재밌게 읽을 수 있다.그렇다면 우리는 이러한 사회변화에 어떻게 대처할 것인가? 책이 본격적으로 다루고자 하는 것은 바로 포스트-인플레이션 시대에 맞는 포트폴리오와 투자전략에 관한 내용이다. 그리고 타인의 이야기에 휘둘리지 않고 주체적인 투자전략을 수립할 수 있도록 적절한 경제공부를 병행할 것을 요구한다. 그리고 이와 시너지를 낼 수 있는 저자의 방향성이 더해지면 모호하기만 한 투자전략을 보다 구체화할 수 있는 계기를 얻을 수 있다.고물가 저성장의 스테그플레이션 시대, 현실을 직시하고 발맞춰 투자하기를 원하는 개인이라면 한 번 쯤은 읽어볼만 한 책이다.                "
"                이 시대 가장 위대한 투자자 레이 달리오가 알려주는 ‘빅 사이클’! 끊임없이 변화하는 세계의 질서 속에서 살아남으려면 이 ‘빅 사이클’을 알아야 하며, 그것을 알려면 이 책을 읽어야 한다. 레이 달리오의 이전 작품인 '원칙'에 이은 투자의 귀재 레이 달리오의 엄청난 책이다. 이 책은 여타 경제서적과 주식투자책처럼 특정종목과 분야를 어필하는 책이 아니다. 인문학적으로 현재 멈추지 않고 변화하는 세계 속의 질서에서 우리가 무엇을 알아야 하고 어떤 자세로 임할지를 알려주는 바이블 그 자체다.                "
                레이달리오의 역사를 읽는 핵심정수가 담겨 있다 추천 할 만하고 꼭 읽으면 좋겠다 투자에 대한 견문 뿐만 아니라 인류의 역사에 대한 정보들을 배울 수 있다 많이들 읽으면 좋겠다 중국 네델란드 영국 미국 다시 중국으로 역사가 이어질 듯한 시대에서 우리는 어떻게 대응하며 살 것인가 잃지 않는 투자에 대해 잘 고민해보길 바란다 그리고 레이달리오의 다른 책들도 함께 곁들인다면 더욱 더 풍부하게 이해 할 수 있을 것이다                
"                '앞으로 어떠한 세계 질서가 확립될 것인가?'저자인 레이 달리오는 세계 최고의 헤지 펀드 회사를 운용 중으로 월가를 선도하는 인물입니다.투자자이지만 국제정치학 및 정치경제학 적인 관점에서 세계의 질서가 어떻게 만들어지는지, 그와 관련해서특정 국가가 어떻게 패권을 가지게 되고 쇠퇴하게 되는가에 대한 내용을 전달해주고 있습니다.지도자의 교체, 교육, 무역 등 국내 질서를 정돈하고 급부상하여 강대국이 되고, 더 나아가 세계 질서를 세우는 과정을 거치면서 패권을 짊어지게 됩니다. 네덜란드로 시작해서 영국, 그리고 현재 미국을 기준으로 세계 질서가 확립되어습니다. 하지만 저자는 미국은 쇠퇴기에 접어들었고, 현재 중국이 급 부상하면서 미중간의 충돌이 왜 발생하였고, 앞으로 어떤 방향으로 흘러갈 것인가에 대해 역사적인 사이클을 통해 독자들에게 넓고 깊은 통찰력을 일깨워 줍니다.책을 읽으면서 세계 질서가 현재 어떠한 상태이고(러우 전쟁, 미중 분쟁 등) 앞으로 어떠한 방향으로 움직일 것인가에 대해서 폭 넓은 시각을 가질 수 있게 되었습니다. 책이 분량이 많고 다소 무거운 내용이지만 그만큼 훌륭한 관점을 배울 수 있는 책이라고 생각합니다.                "
"                한 주가 정신없이 지나가고 일요일 오후인데 무척 피곤하다. 두툼한 레이 달리오의 책을 1부까지 읽었다. 일부 건너뛰어도 상관없는 설명에 해당하는 내용을 건너뛰고 핵심을 이해하려고 노력했다.책을 읽으며 아무리 생각해도 읽기 전에 노자를 읽은 것이 아주 도움이 된다. 동시에 '변화하는 세계질서'라는 책은 꽤 재미있다. 어떤 측면에서는 역사, 경제, 정치와 같은 다양한 분야를 하나에 담아서 분야를 특정하기 어렵지만 결국 자신의 전문 분야이자 강점인 자본으로 분석한다. 우리가 분야라고 특정하는 다양한 사항이 세상의한 조각진실이고, 세상의 진실을 보기 위해서는 조각난 진실을 모아야 한다. 통섭적 이해와 사고가 필요하다는 점을 이 책을 통해서 보여준다.시간 나면레이 달리오가 만화로 설명하는 경제를 보고 읽어도 괜찮을 것 같다.난관이라면 인간이 이런 다방면을 다 이해하기 힘들다. 우리가살아온경쟁의 시대를 넘어 협력의 시대를 열어 더 큰 세상을 만들려고해야 하듯지식과 진실에 대한 도전 분야는 더욱 그렇다. 심각한 문제라면 인간이 그리 장기간 우호적이고 협력적인 구조를 유지할 능력이 떨어지다는 점 아닐까? 잘해야 250년? 그나마 우리나라가 500년을 자주 넘긴 편이기도..레이 달리오는 세상은 특정 순환구조를 갖고 있다고 생각하며, 이 순환구조가 반복되면 점진적인 발전을 하는 경향이 있다고 말한다. 노자는 자연처럼 순환한다고만 말했다. 둘이 같은 말이며 동시에 다르다. 논의 대상이 또 다르나 본질적인 이해는 분야에 따라 변화할 수 있겠다는 생각이 든다.순환구조에 자본과 권력이 가장 큰 영향을 미치는 요인으로 생각한다. 특히 장기부채, 자본시장, 국제질서와 혼란의 사이클이란 어려운 말로 한다. 노자라면 흥망성쇠의 변화가 끊임없이 다가오고, 인위적인 행위의 유한성을 말하지 않았을까? 다른 관점에서 물질은 끊임없이 발전하고, 인간은 퇴보인지 진보인지 요동치는 존재라고 할 수도 있을 것이다. 그래서 각 분야의 관점에 매몰되지 않고, 자신의 속한 분야와 자신의 삶을 책의 말처럼 돌아보며 읽으면 꽤 도움이 되리라 본다.각 시대의 변화와 그변화 기간,또 다른 변화로 전환되는 기간이 다르다. 시장에서 가격과 가치가 다르고, 우리고 그 차이를 집요하게 노리며 투자를 한다. 변화의 기간, 전환 기간이 제각각인 이유는 인간 때문이다. 인간의 생각이 변하고, 행동이 변하고 이해관계에 따라 또 변하고 행동이 변하니 결과도 변한다. 그것이 매일매일같을 리없으니 어쩔 수 없다.경제와 자본은 생산성의 싸움이다. 아무것도 하지 않으면 거지보다 못하다. 거지는 구걸이라도 한다. 변화를 주어 돈을 벌던가 거지보다 못한 삶을 지속할까 결정한다. 10원 벌어 9원 쓰면 1원이 남고, 10원 벌어 100원 쓰면 거지보다 못한 수준에 다다른다. 1원이 남은 사람은 계속 1원을 벌지 더 좋은 수익을 올리기 위한 방법을 찾을지 노력하지만 결과 또한 천차만별이다. -90원이 된 사람은 자포자기를 할지, 빚을 낼지 사기를 칠지, 도둑질을 할지 또 알 수 없지만 이런 선택의 결과도 천차만별이다. 세상의 다양성이 결국 다양한 결과를 도출한다.하지만 시대의 평균은 어떤 성향인지 어림짐작할 수 있다. 개인의 삶도 규모는 다르지만 나아지다 쇠퇴하는 시기가 있다. 중국이나 다른 왕조들이 대개250년 정도를유지한다고 생각하면 한반도에 존재한 국가들이 꽤 대단하고, 미국이란 나라도 비슷한 시기를 거치고 있으니 주도권을 놓지 않기 위해서발버둥 친다고생각할 수 있다. 중요한 것은 정말 그러한지 아는 것이다. 이런 기미를 레이 달리오가 1부를 통해서 길고 다양하게 설명한다. 현재를 살아가는 인간에게 어려움은 경험하지 못한 것, 알지 못한 것은 상상하지 못한다는 점이다. 순환주기가 길어지면 이전은 어떤 단계이며, 지금은 어떤 단계이고, 다음은 어떤 과정인지 잘알지 못한다.인문학이라는 역사, 문학, 철학을 읽는 이유가 그렇고,시서예화가더해져 그 본질을 남기는 것도 인간의 위대한 점이다. 좋은 시절이 오래 유지되면 좋으련만준비 없이재난과 고난의 행군이 시작되기도 한다. 어쩌면 전쟁 세대 이후 최근 30년간 10년마다 푸닥거리를 체험한 세대에게 호우시절은 아니라 생각한다.과거에 읽었던 화폐전쟁, 최근에 읽었던 존 메이너드 케이즈도 특정한 시대를 같이 알기에 괜찮은 것 같다. 관자나 노자도 도움이 될듯하다.자본의 순환은 권력의 순환은 긴밀하다. 정경유착은 인류의 역사와 함께 했다. 정부는 돈이가야 할곳을 결정하고, 세금을 통해서 돈을갖고 올곳도 결정한다. 동시에 정부를 운영하는 사람과 이해관계자들이 정도를 결정한다. 그 다양한 사람들의 행동과 방향이 장기 부채 및 자본시장의 사이클에 영향을 준다고 생각하게 된다. 그 행동의 근원이 되는 시대적 철학과 사고가 국제질서와 혼란의 사이클에 영향을 주는 것은 너무나 당연하다. 그런데 요즘 시대를 상징할 만한 사고와 철학이 있을까? 15년 넘게 법치를 주장하는 시대를살다 보면이것이 결핍이란 생각도 하고, 이것을 찾는 시대가 본질적으로 낮은 수준의 시대란 생각을 한다.레이 달리오처럼 또는 노자처럼 세상이 굴러가는 원칙을 알기 위한 노력도 중요하다. 나처럼 역량이 부족하다면 이들의 도움을 얻어 지금 세상은 어디에 어떤 형태로 굴러가는지 어렴풋이 생각해 보고, 나의 삶은 어떻게 어느 위치에 있는지 돌아봄으로 다음 선택에 참고할 수 있을 것 같다. 여럿이 하면 동네, 더 많은 사람이 하면 국가, 모든 사람이 모이면 세상에 대한 이야기도 가능하겠지만 기대하지는 않는다.약육강식의세계인 1997을 경험하고, 남의 나라 주택담보 대출이 전 세계에 어떻게 불을댕기는지2008년에 체험하고, 역병이 전 세계에 돌아다니는 2019~현재까지의 시간을 보며10년마다난리 난세상을체험 중이다.우리나라를돌아보면 1997을 지나며 한 단계 올라섰지만 주체가 바뀌며 리셋된 기분이 들었다. 08년은난데없는재난에 대응하며 신용이 생명인 화폐가 잉크 조금 찍은 종이인지 가격을 잉크로 찍은 종이인지 가치를 품은 종이인지 혼란스럽기 시작했다. 그건 남의 나라 종이인데 실질적인 여파가우리 집에생기는 말로만듣던매직이었다. 최근엔 더 많은 종이에 잉크를 찍어 돌렸는데 필요한 일이었다고 생각하지만 다른 한편으로 미래로 이전된 저 많은 잉크와 종이값이 걱정인 것은 사실이다. 게다가 많은 사람들이 사라졌다는 아픔도 존재한다. 그럼 점에서 1부 2장과 부록은 꼭 읽어 볼 부분이다.내부질서와 관련해 6단계로 설명하고 미국을 5단계 정도로설명하다.5단계면망조가 붙은 상태쯤 되고, 6단계는 혁명과 내전을 이야기하며 다시 1단계인 새로운 질서의 수립으로 넘어간다고 레이 달리오는 정리했다. 그가 말하는 단계가 획일적으로 딱 맞춰 나타나지는 않는다고 생각한다.우리나라를보면 대단히 혼란스럽다. 과잉의 시대라는 4 단계에 가깝다고 느끼고, 5 단계라는 재정악화와 갈등의 심화라고 하기엔 조금 이르지만 전조 증상은 그리 좋은 편이 아니다. 포퓰리즘, 계급투쟁이라고 할 수는 없지만세대 간계층 간갈등의 고착화, 진실이 사라진 언론을 보면 그렇다. 무신의 난과 같은 쿠데타로 정권을 잡고 정치를 하던 시대가 있었지만, 최근에는 정치가 사라지고 관료가 정치를 하는 공무원의 시대가 열렸다는 생각이 들지만 공무원의 대동단결은 요원하다. 한반도는 내전과 혁명은 아니지만 항상 전쟁 대기상태라고 보면 사이클이 정말 불규칙적으로 변화하는 곳이란 생각이 든다. 이런 시대를 조심하며 내일의 내가 살아가겠지. 어우.금년 들어역병이 좀잠잠해질 만하니전쟁하고, 전쟁으로 식량과 원자재의 파동이 발생하고 있다. 몇 년 윤전기를 돌린 효과는 올라오고, 뭐든 지속성이 아니라느닫없이나타나서 여기저기 문제가 복잡하게 얽히고 있다. 당연히 돈과 관련된 금리, 채권이자, 주식, 환율까지 뭐하나 믿을 것이 없다. 경화인 금의 가치가오른 것을보면 시대를 반영하고 세상에 안전빵은 없다는 진실을 또 말해주는듯하다.2부 500년의 작동원리는 읽지 않을 생각이다. 3부 미래로 직행할 예정이다. 현재를 어떻게 정의하는가는 대단히 중요한 문제다. 현재를 정의해보기 위해 서문, 2부가 필요하다. 1부는 그 과정을 원칙과 이론처럼 만들어 보려는 요약이다. 이 구성을 보면 레이 달리오가 두괄식으로 사람들이 궁금한 점을 이야기하고, 2부에 걸쳐 설명하는 것일까? 아직 읽지 않았지만 그는 현재를 어떻게 보고 미래에 대한 이야기를 할까 궁금하다. 나도 나름의 생각이 있기 때문이다.#레이달리오#세계질서 #원칙 #순환 #노자 #독서 #khori                "
"                이미 몇 년 전에 읽은 책인데 10주년 스페셜 에디션이 나왔다고 하여 미국 서점에서 직접 구매해 읽었습니다.한국에 사는 친구 생일을 맞아 선물을 고민하다가 평소 파이프라인 확장에 관심이 많은 친구라 이 책을 떠올리게 됐고, 센스 만점 선물이라며 책 도착도 전에 너무 고맙다는 메세지를 받아 덩달아 기분이 좋습니다. 언스크립티드와 겹치는 부분이 좀 있지만, 그래도 역시 명불허전인 부의 추월차선 10주년 스페셜 에디션판, 나를 위한 선물로도, 타인을 위한 선물로도강추입니다!!                "
                이책은 읽을때마다 새로운 사실을 알게되는 신기한 책이다한번만 읽지 말고 최소 3번이상은 읽어보기를 권한다느리게 부자되고싶은사람에게는 필요없는책이다빠르게 젊은나이에 성공하고 경제적 자유와 함께 하고싶은 일을 하면서 살고싶은 사람이라면 강력 추천한다엠제이 드마코 저자의 책이 아닌 일본인 저자의 책을 구매하지 않도록 유의하기 바란다한번사는 인생 후회없이 살아보자                
                엠제이 드마코의 부의 추월차선이라는 책을 읽었습니다. 유명하긴 한데 저는 이번에 처음 접해 봤네요. 미국 아마존 책 분야에서 1위했다고 하더라고요.부자가 되는 공식을 제시해서 큰 화제가 됐다고 하던데... 죽도록 일하며 죽을때까지 아끼고 모아서 휠체어에 탈 때쯤 부자되는 40년짜리의 플랜을 비웃으며 한 살이라도 젊을 때 부자가 되어 은퇴하는 방법을 제시한다고 하긴 한데. 흙수저 회사원에겐 다 부질없는 일이긴 하죠.. 미국 감성이 묻어나 있습니다.                
